#Term,Database,ID,Input number,Background number,P-Value,Corrected P-Value,Input,Hyperlink,ORF
Endocytosis,n/a,map04144,13,258,0.435500308205684,0.494204111506136,"O04486, Q9C820, Q0WTY4, O65719, Q9LPN5, Q0WNJ6, Q9LHG8, Q9LHA8, Q9M1K2, Q9SIP0, O82171, B3LF48, Q9T052",,O04486; Q9C820; Q0WTY4; O65719; Q9LPN5; Q0WNJ6; Q9LHG8; Q9LHA8; Q9M1K2; Q9SIP0; O82171; B3LF48; Q9T052
"Valine, leucine and isoleucine degradation",n/a,map00280,10,90,0.00640855134454956,0.0157816026307955,"Q8S528, Q9LPM9, Q570C8, Q9SR86, Q9M401, Q0WM29, F4JML5, Q9SZE1, Q8RXN4, Q940M2",,Q8S528; Q9LPM9; Q570C8; Q9SR86; Q9M401; Q0WM29; F4JML5; Q9SZE1; Q8RXN4; Q940M2
Metabolic pathways,n/a,map01100,418,3837,5.63865392414711E-65,2.04119272054125E-62,"Q9MAM3, Q06402, Q9LMM0, Q9LPC1, Q9SRW9, Q5XEP9, Q940Q1, Q8RY24, F4I8U2, Q9LNE3, P93836, Q8VWZ8, Q05431, Q9SGD6, Q9SJE2, Q9FR37, O80518, O04499, Q9FUS9, Q9FUS8, O65398, O65396, Q8W4M5, O65378, O82567, Q8H1D8, Q39103, Q9FZ49, Q9SHH6, Q9SHH7, Q9FZ62, Q9LN49, Q9FWR4, Q84P25, Q84P21, Q9SYP2, Q9LM59, F4I1A6, Q8S528, Q9ZUB3, Q42565, Q9C664, P55230, Q9SA77, A0A178WJZ2, Q940S3, Q9SA18, O82768, Q7X9V3, Q9C876, A0A384KC76, Q9LNL0, Q67XC9, Q38970, F4I1L3, Q84WV0, Q9SX65, Q9LPM9, A0A178WKH3, Q9C512, Q42524, Q5M729, Q42588, Q9FXB2, A0A1P8AME8, Q9XIF8, O22693, Q9SEV0, O80689, O80690, Q9LQ04, Q9CAD1, P92947, P0CAN7, Q42059, Q9SGU9, Q9S777, Q8L7S6, Q8H191, Q42472, Q9C7U5, Q9C524, Q9ZW95, Q8L9C4, Q94A41, Q9CAI3, Q67YC0, Q94AM5, P94111, Q9C9C4, Q9CA57, Q9S7H8, P14891, Q8GYB8, Q0WPW4, Q9C9S4, Q8L7C9, Q9SYM5, Q9SYM4, Q500Y9, Q9SAK2, Q9AV97, Q9SAJ6, Q42563, P93832, Q9M040, Q9LZM3, Q9LZ06, Q9LZG0, Q9LZS3, F4JW83, Q9LZ66, Q8GW43, A0A1P8B9U3, Q8LEU3, Q8VZW3, P32068, Q9FG08, Q42578, Q39112, Q38946, P50287, Q9FT97, A0A384L5D5, F4KFG5, Q9LX12, Q9LFU1, Q8VZB2, Q9LFP0, Q94A94, Q9LYR4, Q9FY49, Q9FNA9, Q8GZB6, Q9FMT1, Q94AS5, Q9LF05, Q02166, Q3E9D5, Q93ZY3, F4K2L4, A0A1P8BG25, F4K6Z6, Q500W7, Q9FMR0, Q8LAD2, P32746, Q9FNF2, F4JWS8, O82462, Q94C74, Q944B6, Q9FIW4, Q9FF18, Q9FHX0, Q43872, Q96242, Q8H185, Q9M7I7, Q570C8, Q9FI78, P34881, Q9FGS4, Q9FHN4, Q9FLH8, Q9FJ95, Q9ZRA2, Q9FK25, Q38945, P14671, Q9FFT4, Q9FLQ4, Q9FE17, Q9FKK7, Q9FJM5, Q9FUT0, Q8VZC3, Q9FM54, Q84P23, Q42546, Q96511, Q9FMI7, Q37001, F4JZ24, Q9FKW3, Q9FJZ3, O82663, Q9FGC7, P55217, F4J5Z7, A0A1I9LND0, Q9S702, Q9M884, Q9M880, Q9M8S8, Q96324, Q9M9P3, Q9SRQ7, Q9S7A0, Q9SR86, Q9SR37, Q1PER6, Q9SF85, Q9ZSS6, Q9SS45, Q9SG80, Q9S7D1, A0A384K8P2, Q94CD8, Q94IA6, Q9LIB9, Q24JJ8, O49006, Q949X7, Q9LUE1, Q9LUD9, Q9LH76, Q9LJQ9, Q9LUR3, Q8VZF1, Q9ASY9, Q9LSH2, Q9SCX8, Q9LHN4, P49077, D2WL32, P38025, Q9LSY7, Q8LAX0, Q9LIK9, Q94ID1, Q9LK39, Q9LK38, Q9LIR4, A0A384L621, Q9LSV0, Q9LSD0, Q9LK23, A0A384L5L1, Q9LTZ0, Q9LVW7, Q9LK94, Q940V4, P92983, Q9LHR4, Q9LZG7, P32961, O22241, Q9STG6, Q9SD76, Q1PEH3, Q9SMU8, Q8LG70, Q9M401, Q9S818, Q9ASU1, Q96329, Q9LF98, A8MR07, F4JCU3, Q42586, Q9M1G8, Q42529, Q05728, Q9M2W3, Q9M2U2, Q9M2T9, Q9M1K2, P53780, A0A384LHU5, Q94A08, Q05758, Q9LYT7, Q43725, Q8LB01, Q9M1D0, Q9LZJ1, Q9LYB4, Q93WC9, P69834, Q9SJD4, P49572, Q9ZUG4, Q0WM29, Q05762, Q9SI61, Q8L7R2, Q9SHP0, Q8S895, Q9SI16, Q9SLD2, O65896, Q9ZUM9, O82209, O82191, Q8RY79, Q9SIV0, Q7Y223, Q9SJ20, Q501D8, Q6NLQ7, Q8VYN6, P93831, P30184, Q9SJA7, Q570B4, Q9ZUY3, Q9ZW15, Q9ZW16, F4IKM1, Q9ZW26, P32069, P92994, O80852, Q9SJX1, Q39055, A0A178VRB0, O64697, Q5HZ00, O64749, O64753, O64767, O82782, O23647, Q9SJQ9, P35510, Q9ZUR7, Q84TI2, O80912, Q9ZVI7, Q9ZVI9, Q9ZV19, P54887, Q8RXD9, Q9SKX5, Q9ZW84, O22862, O22832, O80574, O64879, O64882, O80823, Q6NQ66, O22893, O23066, P55826, Q9SYJ4, O81301, Q8RXK7, P92979, Q93YW7, Q42592, Q9LDN9, Q9LDA4, Q9M0S8, P39207, O48646, Q9T052, Q8L7W5, Q9SU39, Q9SVQ6, Q94AR8, Q944R1, Q93WN0, F4JML5, Q0WVX5, O49505, O81852, O81862, Q71N54, Q9SB81, O65457, Q9SUW2, P46309, Q9STW8, Q9C5M8, Q9SZX3, A4GNA8, O65583, Q9SZ30, Q6NQE2, Q9M0H6, Q9SZE1, Q9M0F9, Q9SU91, Q9M0B6, O65782, Q8RXN4, Q94JQ3, Q9M076, Q9SMZ4, Q9SZB9, Q00218, Q93ZN9, O49482, O65677, Q05763, Q9STG9, A0A1P8B760, P25819, Q96255, Q42600, Q9M066, O23237, Q8RWM2, Q8VYH2, Q9T074, O65621, Q6NPM8, Q940M2, P42801, O49196, O81346, P93285, Q04614, O05000, P56765, P62090",,Q9MAM3; Q06402; Q9LMM0; Q9LPC1; Q9SRW9; Q5XEP9; Q940Q1; Q8RY24; F4I8U2; Q9LNE3; P93836; Q8VWZ8; Q05431; Q9SGD6; Q9SJE2; Q9FR37; O80518; O04499; Q9FUS9; Q9FUS8; O65398; O65396; Q8W4M5; O65378; O82567; Q8H1D8; Q39103; Q9FZ49; Q9SHH6; Q9SHH7; Q9FZ62; Q9LN49; Q9FWR4; Q84P25; Q84P21; Q9SYP2; Q9LM59; F4I1A6; Q8S528; Q9ZUB3; Q42565; Q9C664; P55230; Q9SA77; A0A178WJZ2; Q940S3; Q9SA18; O82768; Q7X9V3; Q9C876; A0A384KC76; Q9LNL0; Q67XC9; Q38970; F4I1L3; Q84WV0; Q9SX65; Q9LPM9; A0A178WKH3; Q9C512; Q42524; Q5M729; Q42588; Q9FXB2; A0A1P8AME8; Q9XIF8; O22693; Q9SEV0; O80689; O80690; Q9LQ04; Q9CAD1; P92947; P0CAN7; Q42059; Q9SGU9; Q9S777; Q8L7S6; Q8H191; Q42472; Q9C7U5; Q9C524; Q9ZW95; Q8L9C4; Q94A41; Q9CAI3; Q67YC0; Q94AM5; P94111; Q9C9C4; Q9CA57; Q9S7H8; P14891; Q8GYB8; Q0WPW4; Q9C9S4; Q8L7C9; Q9SYM5; Q9SYM4; Q500Y9; Q9SAK2; Q9AV97; Q9SAJ6; Q42563; P93832; Q9M040; Q9LZM3; Q9LZ06; Q9LZG0; Q9LZS3; F4JW83; Q9LZ66; Q8GW43; A0A1P8B9U3; Q8LEU3; Q8VZW3; P32068; Q9FG08; Q42578; Q39112; Q38946; P50287; Q9FT97; A0A384L5D5; F4KFG5; Q9LX12; Q9LFU1; Q8VZB2; Q9LFP0; Q94A94; Q9LYR4; Q9FY49; Q9FNA9; Q8GZB6; Q9FMT1; Q94AS5; Q9LF05; Q02166; Q3E9D5; Q93ZY3; F4K2L4; A0A1P8BG25; F4K6Z6; Q500W7; Q9FMR0; Q8LAD2; P32746; Q9FNF2; F4JWS8; O82462; Q94C74; Q944B6; Q9FIW4; Q9FF18; Q9FHX0; Q43872; Q96242; Q8H185; Q9M7I7; Q570C8; Q9FI78; P34881; Q9FGS4; Q9FHN4; Q9FLH8; Q9FJ95; Q9ZRA2; Q9FK25; Q38945; P14671; Q9FFT4; Q9FLQ4; Q9FE17; Q9FKK7; Q9FJM5; Q9FUT0; Q8VZC3; Q9FM54; Q84P23; Q42546; Q96511; Q9FMI7; Q37001; F4JZ24; Q9FKW3; Q9FJZ3; O82663; Q9FGC7; P55217; F4J5Z7; A0A1I9LND0; Q9S702; Q9M884; Q9M880; Q9M8S8; Q96324; Q9M9P3; Q9SRQ7; Q9S7A0; Q9SR86; Q9SR37; Q1PER6; Q9SF85; Q9ZSS6; Q9SS45; Q9SG80; Q9S7D1; A0A384K8P2; Q94CD8; Q94IA6; Q9LIB9; Q24JJ8; O49006; Q949X7; Q9LUE1; Q9LUD9; Q9LH76; Q9LJQ9; Q9LUR3; Q8VZF1; Q9ASY9; Q9LSH2; Q9SCX8; Q9LHN4; P49077; D2WL32; P38025; Q9LSY7; Q8LAX0; Q9LIK9; Q94ID1; Q9LK39; Q9LK38; Q9LIR4; A0A384L621; Q9LSV0; Q9LSD0; Q9LK23; A0A384L5L1; Q9LTZ0; Q9LVW7; Q9LK94; Q940V4; P92983; Q9LHR4; Q9LZG7; P32961; O22241; Q9STG6; Q9SD76; Q1PEH3; Q9SMU8; Q8LG70; Q9M401; Q9S818; Q9ASU1; Q96329; Q9LF98; A8MR07; F4JCU3; Q42586; Q9M1G8; Q42529; Q05728; Q9M2W3; Q9M2U2; Q9M2T9; Q9M1K2; P53780; A0A384LHU5; Q94A08; Q05758; Q9LYT7; Q43725; Q8LB01; Q9M1D0; Q9LZJ1; Q9LYB4; Q93WC9; P69834; Q9SJD4; P49572; Q9ZUG4; Q0WM29; Q05762; Q9SI61; Q8L7R2; Q9SHP0; Q8S895; Q9SI16; Q9SLD2; O65896; Q9ZUM9; O82209; O82191; Q8RY79; Q9SIV0; Q7Y223; Q9SJ20; Q501D8; Q6NLQ7; Q8VYN6; P93831; P30184; Q9SJA7; Q570B4; Q9ZUY3; Q9ZW15; Q9ZW16; F4IKM1; Q9ZW26; P32069; P92994; O80852; Q9SJX1; Q39055; A0A178VRB0; O64697; Q5HZ00; O64749; O64753; O64767; O82782; O23647; Q9SJQ9; P35510; Q9ZUR7; Q84TI2; O80912; Q9ZVI7; Q9ZVI9; Q9ZV19; P54887; Q8RXD9; Q9SKX5; Q9ZW84; O22862; O22832; O80574; O64879; O64882; O80823; Q6NQ66; O22893; O23066; P55826; Q9SYJ4; O81301; Q8RXK7; P92979; Q93YW7; Q42592; Q9LDN9; Q9LDA4; Q9M0S8; P39207; O48646; Q9T052; Q8L7W5; Q9SU39; Q9SVQ6; Q94AR8; Q944R1; Q93WN0; F4JML5; Q0WVX5; O49505; O81852; O81862; Q71N54; Q9SB81; O65457; Q9SUW2; P46309; Q9STW8; Q9C5M8; Q9SZX3; A4GNA8; O65583; Q9SZ30; Q6NQE2; Q9M0H6; Q9SZE1; Q9M0F9; Q9SU91; Q9M0B6; O65782; Q8RXN4; Q94JQ3; Q9M076; Q9SMZ4; Q9SZB9; Q00218; Q93ZN9; O49482; O65677; Q05763; Q9STG9; A0A1P8B760; P25819; Q96255; Q42600; Q9M066; O23237; Q8RWM2; Q8VYH2; Q9T074; O65621; Q6NPM8; Q940M2; P42801; O49196; O81346; P93285; Q04614; O05000; P56765; P62090
N-Glycan biosynthesis,n/a,map00510,4,78,0.568710192927343,0.616386496526042,"Q9FZ49, Q9C512, Q93ZY3, A0A384LHU5",,Q9FZ49; Q9C512; Q93ZY3; A0A384LHU5
Various types of N-glycan biosynthesis,n/a,map00513,4,62,0.334923701150859,0.406853623545674,"Q9FZ49, Q9C512, Q8L7S6, Q93ZY3",,Q9FZ49; Q9C512; Q8L7S6; Q93ZY3
Lysine degradation,n/a,map00310,8,57,0.00408635914161612,0.0116477323564176,"Q8S528, Q9FG08, Q8GZB6, Q9FLQ4, Q9ZUM9, P93831, Q9SJA7, Q9SMZ4",,Q8S528; Q9FG08; Q8GZB6; Q9FLQ4; Q9ZUM9; P93831; Q9SJA7; Q9SMZ4
Arginine and proline metabolism,n/a,map00330,11,98,0.00407250905149867,0.0117003831479565,"Q9FR37, Q8S528, Q9ZUB3, Q8H191, Q3E9D5, Q8VZC3, F4JZ24, P92983, P54887, Q9SKX5, A0A1P8B760",,Q9FR37; Q8S528; Q9ZUB3; Q8H191; Q3E9D5; Q8VZC3; F4JZ24; P92983; P54887; Q9SKX5; A0A1P8B760
Histidine metabolism,n/a,map00340,5,33,0.0164935982543523,0.033732669876133,"Q8S528, O82768, O82782, Q9SZ30, Q6NPM8",,Q8S528; O82768; O82782; Q9SZ30; Q6NPM8
Tryptophan metabolism,n/a,map00380,13,109,0.00114862648352737,0.00407649791212654,"Q9FR37, Q9XI76, Q8S528, Q7X9V3, Q9FLQ4, P32961, Q8RY79, Q9SIV0, Q501D8, O65782, A0A1P8B760, P25819, O81346",,Q9FR37; Q9XI76; Q8S528; Q7X9V3; Q9FLQ4; P32961; Q8RY79; Q9SIV0; Q501D8; O65782; A0A1P8B760; P25819; O81346
Glycolysis / Gluconeogenesis,n/a,map00010,19,205,0.00175678865296431,0.00567819189618822,"O04499, Q8W4M5, Q9SYP2, Q8S528, Q5M729, Q9C9C4, Q9SAJ6, Q9M040, A0A384L5D5, Q9FFT4, F4J5Z7, Q8VZF1, Q9LF98, A8MR07, Q8VYN6, Q9SJQ9, Q9M0F9, Q9M076, Q9T074",,O04499; Q8W4M5; Q9SYP2; Q8S528; Q5M729; Q9C9C4; Q9SAJ6; Q9M040; A0A384L5D5; Q9FFT4; F4J5Z7; Q8VZF1; Q9LF98; A8MR07; Q8VYN6; Q9SJQ9; Q9M0F9; Q9M076; Q9T074
Ascorbate and aldarate metabolism,n/a,map00053,11,90,0.00224586457760448,0.00700864635424845,"Q05431, Q9FWR4, Q8S528, P92947, F4K6Z6, Q9M8S8, Q1PER6, Q9LK94, Q6NQ66, Q42592, Q6NPM8",,Q05431; Q9FWR4; Q8S528; P92947; F4K6Z6; Q9M8S8; Q1PER6; Q9LK94; Q6NQ66; Q42592; Q6NPM8
Pyruvate metabolism,n/a,map00620,13,156,0.0261602202565915,0.0488144316128151,"O65398, Q8S528, Q38970, F4I1L3, Q5M729, A0A384L5D5, Q8VZF1, A8MR07, Q9M1G8, O82191, Q9ZV19, Q9T074, P56765",,O65398; Q8S528; Q38970; F4I1L3; Q5M729; A0A384L5D5; Q8VZF1; A8MR07; Q9M1G8; O82191; Q9ZV19; Q9T074; P56765
Biosynthesis of secondary metabolites,n/a,map01110,256,2085,5.91467592275812E-48,1.07055634201922E-45,"Q9MAM3, Q06402, Q9LMM0, Q9FZ21, Q5XEP9, Q8RY24, F4I8U2, Q9LNE3, Q8VWZ8, Q9SGD6, O04499, O65396, Q8W4M5, O65378, O82567, Q9XI60, Q39103, Q9FZ80, Q9LN49, Q84P25, Q84P21, Q9SYP2, Q9LM59, F4I1A6, Q8S528, Q42565, P55230, Q9XFR9, Q9SA18, O82768, Q9C876, Q9LNL0, Q67XC9, Q38970, F4I1L3, Q84WV0, Q9SX65, Q9LPM9, Q42524, Q5M729, Q42588, Q9SEV0, O80689, O80690, Q9LQ04, Q9S777, Q42472, Q9C524, Q9ZW95, Q8L9C4, Q94A41, Q9CAI3, P94111, Q9C9C4, Q9C9C9, Q9S7H8, P14891, Q8GYB8, Q0WPW4, Q9C9S4, Q9SYM4, B6EXY6, Q9SAK2, Q9SAJ6, P93832, Q9M040, Q9LZS3, F4JW83, A0A1P8B9U3, Q8LEU3, Q8VZW3, P32068, Q42578, Q39112, P50287, A0A384L5D5, F4KFG5, Q9LX12, Q9LFU1, Q8VZB2, Q94A94, Q9LYR4, Q9FMT1, Q94AS5, Q02166, A0A1P8BG25, Q9FMR0, Q9FG67, Q9FN52, Q8LAD2, Q9FNF2, O82462, Q94C74, Q944B6, Q9FIW4, Q9FF18, Q43872, Q9FJV8, Q96242, Q9M7I7, Q9FI37, Q570C8, Q9FI78, Q9FLH8, Q9FK25, P14671, Q9FFT4, Q9FLQ4, Q9FJM5, Q56Y11, Q570Q8, Q84P23, Q96511, Q9FMI7, Q37001, Q9FKW3, O82663, Q9FGC7, P55217, F4J5Z7, A0A1I9LND0, Q9S702, Q9M884, Q8LFD1, Q9M8S8, Q9M9P3, Q9SRQ7, Q9SR86, Q9SR37, Q9ZSS6, Q9SS45, Q94IA6, Q9LIB9, Q24JJ8, Q949X7, Q9LUE1, Q9LUD9, Q8VZF1, Q9LSH2, Q9LHN4, Q9LE06, D2WL32, P38025, Q9LSY7, Q8LAX0, Q9LIK9, Q94ID1, Q9LIR4, Q9LK23, Q940V4, P92983, Q9LHR4, O22241, Q9SD76, Q9SMU8, Q8LG70, Q9M401, Q9S818, Q96329, Q9LF98, A8MR07, Q9SCP5, F4JCU3, Q42529, Q05728, Q9M2U2, P53780, Q05758, Q9LYT7, Q43725, Q8LB01, Q9M1D0, Q9LZJ1, Q93WC9, P69834, P49572, Q9SI61, Q8L7R2, Q9SHP0, Q8S895, Q9SI16, Q8RY79, Q9SIV0, Q501D8, Q6NLQ7, Q8VYN6, Q570B4, Q9ZUY3, Q9ZW15, Q9ZW16, F4IKM1, P32069, P92994, Q9SJX1, O64697, Q5HZ00, O64767, O82782, O23647, Q9SJQ9, P35510, Q9ZUR7, Q84TI2, O80912, P54887, Q8RXD9, Q9ZW84, O22862, O80574, O64879, O64882, Q8RX88, P55826, Q9LDN9, Q9LDA4, P39207, Q9T052, Q66WT5, Q8L7W5, Q9SU39, Q94AR8, P48421, Q0WVX5, O49505, O81852, Q71N54, O49561, Q9SB81, Q9SZX3, A4GNA8, Q9SZ30, Q6NQE2, Q9M0F9, O65782, Q94JQ3, Q9M076, Q9SMZ4, Q9SZB9, Q00218, Q93ZN9, O49482, O65677, Q9STG9, P25819, Q96255, Q42600, Q9M066, O23237, Q8VYH2, Q9T074, O65621, Q6NPM8, Q940M2, P42801, O81346, P56765",,Q9MAM3; Q06402; Q9LMM0; Q9FZ21; Q5XEP9; Q8RY24; F4I8U2; Q9LNE3; Q8VWZ8; Q9SGD6; O04499; O65396; Q8W4M5; O65378; O82567; Q9XI60; Q39103; Q9FZ80; Q9LN49; Q84P25; Q84P21; Q9SYP2; Q9LM59; F4I1A6; Q8S528; Q42565; P55230; Q9XFR9; Q9SA18; O82768; Q9C876; Q9LNL0; Q67XC9; Q38970; F4I1L3; Q84WV0; Q9SX65; Q9LPM9; Q42524; Q5M729; Q42588; Q9SEV0; O80689; O80690; Q9LQ04; Q9S777; Q42472; Q9C524; Q9ZW95; Q8L9C4; Q94A41; Q9CAI3; P94111; Q9C9C4; Q9C9C9; Q9S7H8; P14891; Q8GYB8; Q0WPW4; Q9C9S4; Q9SYM4; B6EXY6; Q9SAK2; Q9SAJ6; P93832; Q9M040; Q9LZS3; F4JW83; A0A1P8B9U3; Q8LEU3; Q8VZW3; P32068; Q42578; Q39112; P50287; A0A384L5D5; F4KFG5; Q9LX12; Q9LFU1; Q8VZB2; Q94A94; Q9LYR4; Q9FMT1; Q94AS5; Q02166; A0A1P8BG25; Q9FMR0; Q9FG67; Q9FN52; Q8LAD2; Q9FNF2; O82462; Q94C74; Q944B6; Q9FIW4; Q9FF18; Q43872; Q9FJV8; Q96242; Q9M7I7; Q9FI37; Q570C8; Q9FI78; Q9FLH8; Q9FK25; P14671; Q9FFT4; Q9FLQ4; Q9FJM5; Q56Y11; Q570Q8; Q84P23; Q96511; Q9FMI7; Q37001; Q9FKW3; O82663; Q9FGC7; P55217; F4J5Z7; A0A1I9LND0; Q9S702; Q9M884; Q8LFD1; Q9M8S8; Q9M9P3; Q9SRQ7; Q9SR86; Q9SR37; Q9ZSS6; Q9SS45; Q94IA6; Q9LIB9; Q24JJ8; Q949X7; Q9LUE1; Q9LUD9; Q8VZF1; Q9LSH2; Q9LHN4; Q9LE06; D2WL32; P38025; Q9LSY7; Q8LAX0; Q9LIK9; Q94ID1; Q9LIR4; Q9LK23; Q940V4; P92983; Q9LHR4; O22241; Q9SD76; Q9SMU8; Q8LG70; Q9M401; Q9S818; Q96329; Q9LF98; A8MR07; Q9SCP5; F4JCU3; Q42529; Q05728; Q9M2U2; P53780; Q05758; Q9LYT7; Q43725; Q8LB01; Q9M1D0; Q9LZJ1; Q93WC9; P69834; P49572; Q9SI61; Q8L7R2; Q9SHP0; Q8S895; Q9SI16; Q8RY79; Q9SIV0; Q501D8; Q6NLQ7; Q8VYN6; Q570B4; Q9ZUY3; Q9ZW15; Q9ZW16; F4IKM1; P32069; P92994; Q9SJX1; O64697; Q5HZ00; O64767; O82782; O23647; Q9SJQ9; P35510; Q9ZUR7; Q84TI2; O80912; P54887; Q8RXD9; Q9ZW84; O22862; O80574; O64879; O64882; Q8RX88; P55826; Q9LDN9; Q9LDA4; P39207; Q9T052; Q66WT5; Q8L7W5; Q9SU39; Q94AR8; P48421; Q0WVX5; O49505; O81852; Q71N54; O49561; Q9SB81; Q9SZX3; A4GNA8; Q9SZ30; Q6NQE2; Q9M0F9; O65782; Q94JQ3; Q9M076; Q9SMZ4; Q9SZB9; Q00218; Q93ZN9; O49482; O65677; Q9STG9; P25819; Q96255; Q42600; Q9M066; O23237; Q8VYH2; Q9T074; O65621; Q6NPM8; Q940M2; P42801; O81346; P56765
Microbial metabolism in diverse environments,n/a,map01120,67,663,3.87012751841918E-10,7.37361137719864E-09,"Q9FR37, O04499, Q8W4M5, Q9SYP2, Q9LM59, Q8S528, Q9SA18, Q38970, F4I1L3, Q84WV0, Q5M729, Q42588, Q42472, Q9C9C4, Q9SAJ6, Q9LZ66, Q38946, A0A384L5D5, Q94A94, Q9LYR4, Q94AS5, Q8LAD2, O82462, Q94C74, Q9ZRA2, Q38945, Q9FLQ4, Q42546, O82663, F4J5Z7, A0A1I9LND0, Q9S702, Q9S7A0, Q24JJ8, Q949X7, Q9LUR3, Q8VZF1, Q9LSH2, Q9LIK9, Q9LSV0, Q9LK23, P32961, Q8LG70, Q9LF98, A8MR07, Q9M1G8, Q43725, Q8LB01, Q8L7R2, Q9SHP0, Q8S895, O82191, Q8VYN6, Q9SJX1, Q9SJQ9, Q9ZV19, O80574, P92979, O81852, Q9M0F9, Q94JQ3, Q9M076, A0A1P8B760, Q96255, Q9T074, O49196, P56765",,Q9FR37; O04499; Q8W4M5; Q9SYP2; Q9LM59; Q8S528; Q9SA18; Q38970; F4I1L3; Q84WV0; Q5M729; Q42588; Q42472; Q9C9C4; Q9SAJ6; Q9LZ66; Q38946; A0A384L5D5; Q94A94; Q9LYR4; Q94AS5; Q8LAD2; O82462; Q94C74; Q9ZRA2; Q38945; Q9FLQ4; Q42546; O82663; F4J5Z7; A0A1I9LND0; Q9S702; Q9S7A0; Q24JJ8; Q949X7; Q9LUR3; Q8VZF1; Q9LSH2; Q9LIK9; Q9LSV0; Q9LK23; P32961; Q8LG70; Q9LF98; A8MR07; Q9M1G8; Q43725; Q8LB01; Q8L7R2; Q9SHP0; Q8S895; O82191; Q8VYN6; Q9SJX1; Q9SJQ9; Q9ZV19; O80574; P92979; O81852; Q9M0F9; Q94JQ3; Q9M076; A0A1P8B760; Q96255; Q9T074; O49196; P56765
Fatty acid degradation,n/a,map00071,6,79,0.153430680202359,0.212804238441587,"Q8S528, O04469, Q570C8, Q9LK39, Q96329, Q9SJD4",,Q8S528; O04469; Q570C8; Q9LK39; Q96329; Q9SJD4
Glycerolipid metabolism,n/a,map00561,11,104,0.00609709044496077,0.0151693934094557,"Q9LMM0, Q9XI60, Q8S528, Q94AM5, Q9FT97, Q9FNA9, Q8LFD1, Q9S7D1, Q9LHN4, Q9ASU1, Q9SLD2",,Q9LMM0; Q9XI60; Q8S528; Q94AM5; Q9FT97; Q9FNA9; Q8LFD1; Q9S7D1; Q9LHN4; Q9ASU1; Q9SLD2
beta-Alanine metabolism,n/a,map00410,8,75,0.017160522723067,0.0348994900323048,"Q8S528, Q8H191, Q42472, Q9LSH2, Q96329, Q0WM29, Q9SKX5, Q8RXN4",,Q8S528; Q8H191; Q42472; Q9LSH2; Q96329; Q0WM29; Q9SKX5; Q8RXN4
Limonene and pinene degradation,n/a,map00903,1,12,0.408873233277428,0.469879715702949,Q8S528,,Q8S528
Insect hormone biosynthesis,n/a,map00981,1,10,0.359073485467908,0.431126373928301,Q8S528,,Q8S528
Chloroalkane and chloroalkene degradation,n/a,map00625,1,23,0.62114882482647,0.663291665448915,Q8S528,,Q8S528
Monobactam biosynthesis,n/a,map00261,6,27,0.0017009802679376,0.0055473410539947,"Q9SA18, Q9S702, Q9LIK9, Q8LB01, O80574, O81852",,Q9SA18; Q9S702; Q9LIK9; Q8LB01; O80574; O81852
Sulfur metabolism,n/a,map00920,13,71,2.62977395294892E-05,0.000176292253882872,"Q9C876, Q42588, Q9LZ66, Q38945, Q42546, P55217, Q9LIK9, Q9LK38, Q43725, Q8S895, P92979, Q93WN0, O49196",,Q9C876; Q42588; Q9LZ66; Q38945; Q42546; P55217; Q9LIK9; Q9LK38; Q43725; Q8S895; P92979; Q93WN0; O49196
Selenocompound metabolism,n/a,map00450,6,30,0.00270340366099879,0.00815526771067968,"Q9C876, Q9SGU9, P55217, Q9LIK9, Q9M2T9, P53780",,Q9C876; Q9SGU9; P55217; Q9LIK9; Q9M2T9; P53780
Purine metabolism,n/a,map00230,20,167,6.05829618120037E-05,0.000353726325418473,"Q8H1D8, Q9CAD1, Q42563, Q9LZG0, A0A384L5D5, Q9LFP0, Q9SF85, P38025, Q9LIK9, Q9LSD0, A8MR07, Q05728, Q9SI61, Q9SJ20, O64767, Q84TI2, P39207, Q9SUW2, Q9STG9, O49196",,Q8H1D8; Q9CAD1; Q42563; Q9LZG0; A0A384L5D5; Q9LFP0; Q9SF85; P38025; Q9LIK9; Q9LSD0; A8MR07; Q05728; Q9SI61; Q9SJ20; O64767; Q84TI2; P39207; Q9SUW2; Q9STG9; O49196
Plant hormone signal transduction,n/a,map04075,49,496,2.02121618960646E-07,2.21721291102284E-06,"P93830, Q9LNW3, Q9ZWS7, Q9FXI2, P93024, Q9C5U1, Q39204, Q9M7Q5, Q9C958, Q9C9E3, Q9SSM7, Q8S307, Q9CA25, Q9FLB1, E3VNM4, P43292, Q9LX16, A0A178UED2, Q708Y0, Q9FHD7, Q8L746, Q9FLI3, Q9LSQ4, Q9FIF5, Q39193, Q9SRW1, Q6NMM4, Q9LU15, Q8H174, Q38825, Q0WPQ2, Q9SLH3, Q9C5U0, O64812, O22190, O80992, O23661, Q9SJN0, O80920, Q9ZNS2, O49686, O81829, Q9ZSY8, O81888, Q940H6, P42753, O65694, A0A178UUI1, Q9SMQ4",,P93830; Q9LNW3; Q9ZWS7; Q9FXI2; P93024; Q9C5U1; Q39204; Q9M7Q5; Q9C958; Q9C9E3; Q9SSM7; Q8S307; Q9CA25; Q9FLB1; E3VNM4; P43292; Q9LX16; A0A178UED2; Q708Y0; Q9FHD7; Q8L746; Q9FLI3; Q9LSQ4; Q9FIF5; Q39193; Q9SRW1; Q6NMM4; Q9LU15; Q8H174; Q38825; Q0WPQ2; Q9SLH3; Q9C5U0; O64812; O22190; O80992; O23661; Q9SJN0; O80920; Q9ZNS2; O49686; O81829; Q9ZSY8; O81888; Q940H6; P42753; O65694; A0A178UUI1; Q9SMQ4
Regulation of actin cytoskeleton,n/a,map04810,11,119,0.0198213738194033,0.0396427476388066,"Q9LQQ9, Q5S2C3, O82733, Q9FJV0, Q9FE63, O82481, Q9M1K2, Q38902, Q9XGU0, O82480, Q38904",,Q9LQQ9; Q5S2C3; O82733; Q9FJV0; Q9FE63; O82481; Q9M1K2; Q38902; Q9XGU0; O82480; Q38904
Bacterial invasion of epithelial cells,n/a,map05100,5,48,0.0583136620168374,0.0929935931722253,"O82481, Q0WNJ6, Q38902, Q9XGU0, O82480",,O82481; Q0WNJ6; Q38902; Q9XGU0; O82480
Pathogenic Escherichia coli infection,n/a,map05130,21,152,5.81700623772855E-06,5.01370537632794E-05,"Q9LQQ9, Q9LQY3, Q9FVQ1, B9DGT7, F4HWY6, Q9SAJ6, P29514, Q5S2C3, B9DHQ0, Q9LD45, O82481, Q38902, F4IUG9, P29515, F4IRU3, Q9XGU0, Q9T0G2, P29511, P29517, O82480, Q0WPU1",,Q9LQQ9; Q9LQY3; Q9FVQ1; B9DGT7; F4HWY6; Q9SAJ6; P29514; Q5S2C3; B9DHQ0; Q9LD45; O82481; Q38902; F4IUG9; P29515; F4IRU3; Q9XGU0; Q9T0G2; P29511; P29517; O82480; Q0WPU1
Shigellosis,n/a,map05131,20,241,0.00588498457391283,0.0154374233025829,"Q8RVQ9, Q9SRZ0, Q9LQQ9, P59226, Q39019, P59271, Q9S709, P0CH31, Q9FE63, O82481, P35134, Q9C566, Q38902, B9DHA6, Q9XGU0, Q9T0G2, Q8VYK7, O82480, Q38904, Q8H1Q8",,Q8RVQ9; Q9SRZ0; Q9LQQ9; P59226; Q39019; P59271; Q9S709; P0CH31; Q9FE63; O82481; P35134; Q9C566; Q38902; B9DHA6; Q9XGU0; Q9T0G2; Q8VYK7; O82480; Q38904; Q8H1Q8
Salmonella infection,n/a,map05132,23,230,0.000250053518147913,0.00123999141876088,"Q9LQQ9, Q9LR39, Q93VQ9, Q9C8H6, Q9C820, Q9XIF4, Q8S3U9, Q9SAJ6, Q5S2C3, P27323, O03986, Q9FJV0, Q9FE63, O82481, A0A384KCC1, Q8LCH9, Q38902, O80625, Q9XGU0, Q9SEU8, Q9T0G2, O82480, Q38904",,Q9LQQ9; Q9LR39; Q93VQ9; Q9C8H6; Q9C820; Q9XIF4; Q8S3U9; Q9SAJ6; Q5S2C3; P27323; O03986; Q9FJV0; Q9FE63; O82481; A0A384KCC1; Q8LCH9; Q38902; O80625; Q9XGU0; Q9SEU8; Q9T0G2; O82480; Q38904
Fc gamma R-mediated phagocytosis,n/a,map04666,8,106,0.093732605569502,0.13963458113646,"Q9LQQ9, Q9FJV0, O82481, Q9M1K2, Q38902, Q9XGU0, Q9T052, O82480",,Q9LQQ9; Q9FJV0; O82481; Q9M1K2; Q38902; Q9XGU0; Q9T052; O82480
"Glycine, serine and threonine metabolism",n/a,map00260,18,123,1.31068396175762E-05,0.00010095055194814,"O04499, O65396, Q9LM59, Q9SA18, Q84WV0, Q94C74, P14671, Q9S702, Q9SR86, Q9ZSS6, Q42529, Q8L7R2, Q9SHP0, Q9SJA7, O81852, Q94JQ3, Q96255, Q940M2",,O04499; O65396; Q9LM59; Q9SA18; Q84WV0; Q94C74; P14671; Q9S702; Q9SR86; Q9ZSS6; Q42529; Q8L7R2; Q9SHP0; Q9SJA7; O81852; Q94JQ3; Q96255; Q940M2
Tyrosine metabolism,n/a,map00350,4,59,0.317698099962084,0.388536189818495,"P93836, Q9ZRA2, Q9LUR3, Q8RY79",,P93836; Q9ZRA2; Q9LUR3; Q8RY79
Phenylalanine metabolism,n/a,map00360,6,49,0.0213342737539657,0.0416334614497875,"P93836, Q9FR37, Q9SS45, Q8RY79, P35510, A0A1P8B760",,P93836; Q9FR37; Q9SS45; Q8RY79; P35510; A0A1P8B760
Isoquinoline alkaloid biosynthesis,n/a,map00950,1,32,1,1.00976290097629,Q8RY79,,Q8RY79
"Tropane, piperidine and pyridine alkaloid biosynthesis",n/a,map00960,3,54,0.494160704682539,0.54957350259625,"Q9ZW15, Q9ZW16, F4IKM1",,Q9ZW15; Q9ZW16; F4IKM1
Autophagy - yeast,n/a,map04138,12,145,0.0360014539095474,0.0640418983550671,"Q9C820, Q9FE78, Q8LDQ4, Q9SF09, Q9LSD6, Q9SCK0, Q8RUS5, Q8GYQ5, Q9M0Y8, Q8VYK7, Q8H1Q8, Q9SVG0",,Q9C820; Q9FE78; Q8LDQ4; Q9SF09; Q9LSD6; Q9SCK0; Q8RUS5; Q8GYQ5; Q9M0Y8; Q8VYK7; Q8H1Q8; Q9SVG0
Protein digestion and absorption,n/a,map04974,2,15,0.144362256457485,0.205340419794143,"Q9SF09, Q9SVG0",,Q9SF09; Q9SVG0
Phenylpropanoid biosynthesis,n/a,map00940,39,280,6.42542252344796E-10,1.16300147674408E-08,"Q9LNL0, Q42524, O80689, O80690, Q9S777, Q9CAI3, F4JW83, A0A1P8B9U3, Q42578, A0A1P8BG25, Q9FMR0, Q9FIW4, Q43872, Q9FI78, Q9FK25, Q84P23, Q96511, Q9FMI7, Q9SR37, Q9SS45, Q9LSY7, Q9SMU8, Q9M1D0, Q9LZJ1, Q9SI16, P92994, P35510, O80912, O22862, O64879, O64882, Q9LDN9, Q9LDA4, Q9SB81, Q9SZB9, O49482, Q42600, O23237, O65621",,Q9LNL0; Q42524; O80689; O80690; Q9S777; Q9CAI3; F4JW83; A0A1P8B9U3; Q42578; A0A1P8BG25; Q9FMR0; Q9FIW4; Q43872; Q9FI78; Q9FK25; Q84P23; Q96511; Q9FMI7; Q9SR37; Q9SS45; Q9LSY7; Q9SMU8; Q9M1D0; Q9LZJ1; Q9SI16; P92994; P35510; O80912; O22862; O64879; O64882; Q9LDN9; Q9LDA4; Q9SB81; Q9SZB9; O49482; Q42600; O23237; O65621
Starch and sucrose metabolism,n/a,map00500,36,276,1.32398586461622E-08,1.91713153196429E-07,"Q8RY24, F4I8U2, Q9LNE3, F4I1A6, P55230, Q67XC9, O80689, O80690, Q42059, Q9C7U5, Q9C524, Q94A41, Q9C9S4, Q9SYM4, Q9LZS3, A0A1P8B9U3, F4KFG5, A0A1P8BG25, Q9FNF2, Q9FIW4, Q9FLH8, Q9M9P3, Q9SR37, Q94CD8, Q9LIB9, D2WL32, Q9SD76, Q9M1D0, Q9LZJ1, O23647, Q8RXD9, O64879, O64882, Q9SU39, Q0WVX5, Q9STW8",,Q8RY24; F4I8U2; Q9LNE3; F4I1A6; P55230; Q67XC9; O80689; O80690; Q42059; Q9C7U5; Q9C524; Q94A41; Q9C9S4; Q9SYM4; Q9LZS3; A0A1P8B9U3; F4KFG5; A0A1P8BG25; Q9FNF2; Q9FIW4; Q9FLH8; Q9M9P3; Q9SR37; Q94CD8; Q9LIB9; D2WL32; Q9SD76; Q9M1D0; Q9LZJ1; O23647; Q8RXD9; O64879; O64882; Q9SU39; Q0WVX5; Q9STW8
Cyanoamino acid metabolism,n/a,map00460,16,104,2.25038615985749E-05,0.000153705620729889,"Q9LM59, Q84WV0, O80689, O80690, A0A1P8B9U3, P50287, A0A1P8BG25, Q94C74, Q9FIW4, Q9SR37, P32961, Q9M1D0, Q9LZJ1, O64879, O64882, Q94JQ3",,Q9LM59; Q84WV0; O80689; O80690; A0A1P8B9U3; P50287; A0A1P8BG25; Q94C74; Q9FIW4; Q9SR37; P32961; Q9M1D0; Q9LZJ1; O64879; O64882; Q94JQ3
Hedgehog signaling pathway,n/a,map04340,4,48,0.150392345328947,0.209392419265688,"Q9LQ95, Q9SRZ0, Q39019, P0CH31",,Q9LQ95; Q9SRZ0; Q39019; P0CH31
Hedgehog signaling pathway - fly,n/a,map04341,5,81,0.395422124587315,0.458056989121946,"Q9LQ95, Q9SRZ0, Q39019, P0CH31, Q2QAV0",,Q9LQ95; Q9SRZ0; Q39019; P0CH31; Q2QAV0
MAPK signaling pathway - plant,n/a,map04016,31,238,1.3313597267492E-07,1.60650740361071E-06,"Q06402, Q9ZVP5, Q9LNW3, Q39204, Q9FZ36, Q9C958, Q9SH30, P0DH95, Q9SSM7, Q9FLB1, P43292, Q9LX16, Q708Y0, Q9FLI3, Q700C7, Q9FIF5, Q39193, Q0WPQ2, Q9LSF1, Q9LW27, O64812, O80992, O80888, O80920, O04609, P39207, O49686, O81888, Q940H6, P25819, Q9SMQ4",,Q06402; Q9ZVP5; Q9LNW3; Q39204; Q9FZ36; Q9C958; Q9SH30; P0DH95; Q9SSM7; Q9FLB1; P43292; Q9LX16; Q708Y0; Q9FLI3; Q700C7; Q9FIF5; Q39193; Q0WPQ2; Q9LSF1; Q9LW27; O64812; O80992; O80888; O80920; O04609; P39207; O49686; O81888; Q940H6; P25819; Q9SMQ4
Plant-pathogen interaction,n/a,map04626,29,339,0.000652459611568541,0.00274639976032339,"Q9MAM3, Q5XEP9, Q9LNE7, Q9LN49, P0DH95, Q06850, P27323, O03986, Q9FG77, Q9FJV0, Q9M8U1, Q39214, Q9SS31, Q9LIK5, Q9LI84, Q9S744, Q9LX27, P43295, Q570B4, Q9SL29, P25071, Q9LD40, O04609, Q9ZT91, O23320, Q9SUR9, Q42484, O81888, O65677",,Q9MAM3; Q5XEP9; Q9LNE7; Q9LN49; P0DH95; Q06850; P27323; O03986; Q9FG77; Q9FJV0; Q9M8U1; Q39214; Q9SS31; Q9LIK5; Q9LI84; Q9S744; Q9LX27; P43295; Q570B4; Q9SL29; P25071; Q9LD40; O04609; Q9ZT91; O23320; Q9SUR9; Q42484; O81888; O65677
Photosynthesis - antenna proteins,n/a,map00196,1,40,1,1.00976290097629,A0A178VRB0,,A0A178VRB0
Cell cycle,n/a,map04110,52,206,3.78990243149418E-22,4.57314893400298E-20,"Q8L4H0, Q9SRZ0, Q8H1U4, Q8W032, Q9M7Q7, Q39019, Q9LMT0, Q9ZVH3, P0CH31, Q9C6Y3, Q9LPD9, Q9C6A9, Q3ECW2, Q9FV70, Q9C701, Q8L981, Q84VX4, B3DNN5, Q9C968, Q147G5, Q8LPL5, Q39071, Q9FKS4, Q9FMH5, F4KAB8, Q9FL33, Q06AN9, Q9LJN8, Q9LSG6, Q9LU93, Q8H0W2, Q6Q1P4, Q6EWX1, Q8H1U5, O80786, Q0WVF5, F4IVI0, Q56YN8, O22806, Q9FNY0, Q38899, Q8VY89, O82265, P43299, Q9SU24, Q710E8, Q0WPK0, O65418, Q5IBC5, Q9S7I8, Q9SZA4, O22446",,Q8L4H0; Q9SRZ0; Q8H1U4; Q8W032; Q9M7Q7; Q39019; Q9LMT0; Q9ZVH3; P0CH31; Q9C6Y3; Q9LPD9; Q9C6A9; Q3ECW2; Q9FV70; Q9C701; Q8L981; Q84VX4; B3DNN5; Q9C968; Q147G5; Q8LPL5; Q39071; Q9FKS4; Q9FMH5; F4KAB8; Q9FL33; Q06AN9; Q9LJN8; Q9LSG6; Q9LU93; Q8H0W2; Q6Q1P4; Q6EWX1; Q8H1U5; O80786; Q0WVF5; F4IVI0; Q56YN8; O22806; Q9FNY0; Q38899; Q8VY89; O82265; P43299; Q9SU24; Q710E8; Q0WPK0; O65418; Q5IBC5; Q9S7I8; Q9SZA4; O22446
